{
  "run_id": "20260927T114621Z-04c6c02c9ae1",
  "captured_at": "2026-09-27T11:46:21.997719+00:00",
  "observations": {
    "swap_exit_code": 0,
    "production_restart_observed": true,
    "non_sticky_feature_flag_swapped": true,
    "production_config_changed": true,
    "post_rollback_matches_pre_swap": true
  },
  "collector": "scripts/golden/collect_scenario_c.py",
  "incomplete_fields": [
    "deployment_error_count",
    "sticky_db_connection_remained"
  ],
  "capture_provenance": "derived"
}
