{
  "run_id": "20261016T153835Z-275d216becd8",
  "resource_id": null,
  "captured_at": "2026-10-16T15:38:35.163159+00:00",
  "runner_source_commit": "f7acab4bca5ea253a36e78fc5c4753b572093693",
  "observations": {
    "swap_exit_code": 0,
    "production_restart_observed": true,
    "non_sticky_feature_flag_swapped": true,
    "sticky_db_connection_remained": true,
    "production_config_changed": true,
    "post_rollback_matches_pre_swap": true,
    "raw_snapshots": {
      "prod_before": {
        "DB_CONNECTION_STRING": "prod-server..database.windows.net",
        "FEATURE_FLAG": "v1",
        "PROCESS_START_UTC": "2026-10-16T15:35:22.800266+00:00",
        "WEBSITE_SLOT_NAME": "Production"
      },
      "staging_before": {
        "DB_CONNECTION_STRING": "staging-server..database.windows.net",
        "FEATURE_FLAG": "v2",
        "PROCESS_START_UTC": "2026-10-16T15:39:18.207493+00:00",
        "WEBSITE_SLOT_NAME": "Production"
      },
      "prod_after": {
        "DB_CONNECTION_STRING": "prod-server..database.windows.net",
        "FEATURE_FLAG": "v2",
        "PROCESS_START_UTC": "2026-10-16T15:40:52.298804+00:00",
        "WEBSITE_SLOT_NAME": "Production"
      },
      "staging_after": {
        "DB_CONNECTION_STRING": "staging-server..database.windows.net",
        "FEATURE_FLAG": "v1",
        "PROCESS_START_UTC": "2026-10-16T15:44:27.189513+00:00",
        "WEBSITE_SLOT_NAME": "Production"
      },
      "prod_after_rollback": {
        "DB_CONNECTION_STRING": "prod-server..database.windows.net",
        "FEATURE_FLAG": "v1",
        "PROCESS_START_UTC": "2026-10-16T15:46:25.553083+00:00",
        "WEBSITE_SLOT_NAME": "Production"
      },
      "swap": {
        "argv": [
          "az",
          "webapp",
          "deployment",
          "slot",
          "swap",
          "--resource-group",
          "rg-scenario-c-example",
          "--name",
          "app-scenario-c-example",
          "--slot",
          "staging",
          "--target-slot",
          "production",
          "--output",
          "json"
        ],
        "started_at": "2026-10-16T15:39:19.499624+00:00",
        "ended_at": "2026-10-16T15:41:55.396870+00:00",
        "exit_code": 0,
        "stdout": "",
        "stderr": ""
      },
      "deployment_error_rows": []
    },
    "phase_capture_integrity": {
      "baseline": {
        "probe_count": 2,
        "sha256": "53df743c9ee44ed8e603cddc2a52c11c7e55add787c306902a9cecc8a51c947a"
      },
      "fault": {
        "probe_count": 2,
        "sha256": "5c2ca33012ae9cfb9cbf0654c14ee6e300fb7d9d21a5d9bed46ce5c9699fc9f2"
      },
      "recovery": {
        "probe_count": 1,
        "sha256": "cd7672d2e6bce1a6df26c1cad439e5401470649b0546e78e7e3e57bc2f8e21c1"
      }
    },
    "raw_file_digests": {
      "baseline/phase.json": "53df743c9ee44ed8e603cddc2a52c11c7e55add787c306902a9cecc8a51c947a",
      "cleanup.json": "6a01a22e13bd2fa01319333220049fffa3ab10d20c0dd26d37c88cdbc1fee9bd",
      "console-query-0.json": "9bd3b92cf71e2a9adc09a6554f8ea498d5f0a4e795998048896fcd4df4becb73",
      "fault/phase.json": "5c2ca33012ae9cfb9cbf0654c14ee6e300fb7d9d21a5d9bed46ce5c9699fc9f2",
      "prod-after-rollback.json": "cea1032cd8dded4e0f9b87e9abfa9c79331e939442c188c7f87957f478dab923",
      "prod-after.json": "1880e1920c3f2703fd348f9bbe1f7c637b60ea01b8d91ab69ffe2a6f8b08dea3",
      "prod-before.json": "16809d8bcbcc3cab96fcbce3c2ff11a1bcc8f17226eb3a47f6bddd51c57fbcc9",
      "prod-restart-wait.json": "a59c740c687c4a773221eedc8c574b3378a51471417fd20ffc26769cba7fff71",
      "recovery/phase.json": "cd7672d2e6bce1a6df26c1cad439e5401470649b0546e78e7e3e57bc2f8e21c1",
      "rollback-restart-wait.json": "5d30137061908ff27b4d59935790c4f6c1092500e02e025d3dbfce1582a8b973",
      "run-complete.json": "b4d48537f91c6928d008b56e46fc8499365e7011f1b4a8bd9c64f7c459c14a24",
      "run.json": "9c7b76718c12bea813dd72ceb7f72dbb0d7309475bc34b3c40937e9f722862a8",
      "staging-after.json": "5027213f2534d0b5dc607c5cbd560393edee8e8b54b9ed69e27abae80f4a43fc",
      "staging-before.json": "e9ac428b09fa3ee8b2d18e3830615a2e7d8458205000f01ecae1f3a77ad13c3b",
      "staging-restart-wait.json": "6c04fad943aaf7c54c60e6a45a035fe3a61e995060ffaaa019189c1f1e9d5056",
      "swap-back.json": "a6e4f008d6f2f715aa699f7fbfbdb557e8524e3cca893c05a49e1a4f6f16554e",
      "swap.json": "5813c2dd74be3bd9013ce2bb5dc77e720b78330160790975fd61998067665249",
      "warmup.json": "c4e32031dae9a7ce4a9bf2160d8438868a2957e0a0c772f55c544e89d87d927f"
    }
  },
  "collector": "scripts/golden/collect_scenario_c.py",
  "capture_provenance": "derived",
  "incomplete_fields": [
    "deployment_error_count"
  ]
}
