{
  "run_id": "20261016T131733Z-ca62fd8ccb42",
  "resource_id": null,
  "captured_at": "2026-10-16T13:17:33.255168+00:00",
  "runner_source_commit": "4c3760aa4a71bfe24aa1c51ff708e8701eef5b6f",
  "observations": {
    "swap_exit_code": 0,
    "production_restart_observed": true,
    "production_config_changed": true,
    "deployment_error_count": 0,
    "post_rollback_matches_pre_swap": true,
    "raw_snapshots": {
      "prod_before": {
        "DB_CONNECTION_STRING": "prod-server..database.windows.net",
        "FEATURE_FLAG": "v1",
        "PROCESS_START_UTC": "2026-10-16T12:23:14.082824+00:00",
        "WEBSITE_SLOT_NAME": "Production"
      },
      "staging_before": {
        "unreachable": "The read operation timed out"
      },
      "prod_after": {
        "DB_CONNECTION_STRING": "prod-server..database.windows.net",
        "FEATURE_FLAG": "v2",
        "PROCESS_START_UTC": "2026-10-16T13:21:36.087539+00:00",
        "WEBSITE_SLOT_NAME": "Production"
      },
      "staging_after": {
        "DB_CONNECTION_STRING": "staging-server..database.windows.net",
        "FEATURE_FLAG": "v1",
        "PROCESS_START_UTC": "2026-10-16T13:24:22.164131+00:00",
        "WEBSITE_SLOT_NAME": "Production"
      },
      "prod_after_rollback": {
        "DB_CONNECTION_STRING": "prod-server..database.windows.net",
        "FEATURE_FLAG": "v1",
        "PROCESS_START_UTC": "2026-10-16T13:26:37.721347+00:00",
        "WEBSITE_SLOT_NAME": "Production"
      },
      "swap": {
        "argv": [
          "az",
          "webapp",
          "deployment",
          "slot",
          "swap",
          "--resource-group",
          "<resource-group>",
          "--name",
          "<app-name>",
          "--slot",
          "staging",
          "--target-slot",
          "production",
          "--output",
          "json"
        ],
        "started_at": "2026-10-16T13:18:03.861791+00:00",
        "ended_at": "2026-10-16T13:22:28.325011+00:00",
        "exit_code": 0,
        "stdout": "",
        "stderr": ""
      },
      "deployment_error_rows": []
    },
    "phase_capture_integrity": {
      "baseline": {
        "probe_count": 2,
        "sha256": "06e7d17bb92d782fe0565109dee2e06afd76ff93aa0362cba1c4497579c47526"
      },
      "fault": {
        "probe_count": 2,
        "sha256": "7b74d86a7fed507c1c372cb51f92a82b46ab28c9ccf3d4765ea8814beb1a9332"
      },
      "recovery": {
        "probe_count": 1,
        "sha256": "62db030ed4cd7312d42fadf232a391d8204e4a6f5e2489cfb0a56e0dae7d655d"
      }
    }
  },
  "collector": "scripts/golden/collect_scenario_c.py",
  "capture_provenance": "derived",
  "incomplete_fields": [
    "non_sticky_feature_flag_swapped",
    "sticky_db_connection_remained"
  ]
}
